{
  "schema_version": 1,
  "specialist_id": "aerodynamics-cfd-validator",
  "version": "1.0.0",
  "source": {
    "repository": "https://github.com/K-Dense-AI/scientific-agent-skills",
    "commit": "36d8f13a1e754618794bf42f417884940077b4ae",
    "license": "MIT"
  },
  "artifact": {
    "path": "specialists/aerodynamics-cfd-validator/1.0.0/aerodynamics-cfd-validator-1.0.0.zip",
    "github_release": {
      "tag": "aerodynamics-cfd-validator-v1.0.0",
      "asset_name": "aerodynamics-cfd-validator-1.0.0.zip"
    },
    "sha256": "c6b53beb8973928a0a2261e883b62d3ac7749d5d95c299cb60d76d8c5ff6213d",
    "compressed_bytes": 172124,
    "uncompressed_bytes": 462235,
    "file_count": 40
  },
  "defaults": {
    "skill_ids": [
      "experimental-design",
      "fluidsim",
      "uncertainty-and-units"
    ],
    "connector_ids": [
      "research-resources",
      "literature"
    ]
  },
  "skills": [
    {
      "id": "experimental-design",
      "name": "experimental-design",
      "display_name": "Experimental Design",
      "description": "Designs randomized, blocked, factorial, response-surface, and sequential experiments while preventing confounding and pseudoreplication.",
      "path": "skills/experimental-design",
      "content_digest": "0b0c009f12b72f8d3b5712c08ad21bfafded2310963a4c85aaa4add83d241933",
      "file_count": 7,
      "uncompressed_bytes": 53960
    },
    {
      "id": "fluidsim",
      "name": "fluidsim",
      "display_name": "FluidSim",
      "description": "Plans and audits bounded FluidSim simulations, solver configuration, outputs, restarts, and computational-resource requirements.",
      "path": "skills/fluidsim",
      "content_digest": "2a41a8224baa9bd6c65c0b9776e2ddeacef45aeaa729ae021a739e37106a66d3",
      "file_count": 16,
      "uncompressed_bytes": 175462
    },
    {
      "id": "uncertainty-and-units",
      "name": "uncertainty-and-units",
      "display_name": "Uncertainty and Units",
      "description": "Audits units, dimensional consistency, plausibility, and measurement-uncertainty propagation in scientific calculations.",
      "path": "skills/uncertainty-and-units",
      "content_digest": "155fa7899bb8eb064a5195fdb799f57542cdcd0e6cc04e3ecbe4e695cfd146da",
      "file_count": 14,
      "uncompressed_bytes": 207652
    }
  ],
  "connectors": [
    {
      "id": "research-resources",
      "required": false,
      "default_selected": true
    },
    {
      "id": "literature",
      "required": false,
      "default_selected": true
    }
  ]
}
