{
  "schema_version": 1,
  "specialist_id": "cryoem-structure-validator",
  "version": "1.0.0",
  "source": {
    "repository": "https://github.com/K-Dense-AI/scientific-agent-skills",
    "commit": "36d8f13a1e754618794bf42f417884940077b4ae",
    "license": "MIT"
  },
  "artifact": {
    "path": "specialists/cryoem-structure-validator/1.0.0/cryoem-structure-validator-1.0.0.zip",
    "github_release": {
      "tag": "cryoem-structure-validator-v1.0.0",
      "asset_name": "cryoem-structure-validator-1.0.0.zip"
    },
    "sha256": "7e00a6eaa7cf85c7e813c94ecc8fd850adc2a1652353e78405fd427a7a8ad68e",
    "compressed_bytes": 200278,
    "uncompressed_bytes": 543354,
    "file_count": 42
  },
  "defaults": {
    "skill_ids": [
      "scientific-visualization",
      "statistical-analysis",
      "uncertainty-and-units"
    ],
    "connector_ids": [
      "structures",
      "protein-annotation",
      "literature",
      "pubmed"
    ]
  },
  "skills": [
    {
      "id": "scientific-visualization",
      "name": "scientific-visualization",
      "display_name": "Scientific Visualization",
      "description": "Creates and audits truthful, accessible, publication-ready scientific figures and export settings.",
      "path": "skills/scientific-visualization",
      "content_digest": "86e85df3386b4d814983d893183ad7749f1c4f5a2d9a230e648cf65e138e44ea",
      "file_count": 18,
      "uncompressed_bytes": 189804
    },
    {
      "id": "statistical-analysis",
      "name": "statistical-analysis",
      "display_name": "Statistical Analysis",
      "description": "Guides test selection, assumptions, effect sizes, power, Bayesian alternatives, and transparent statistical reporting.",
      "path": "skills/statistical-analysis",
      "content_digest": "e500941b3db38fc61cba704dc58e435ac1669ccb500e1a596e44c91861e39038",
      "file_count": 7,
      "uncompressed_bytes": 116948
    },
    {
      "id": "uncertainty-and-units",
      "name": "uncertainty-and-units",
      "display_name": "Uncertainty and Units",
      "description": "Audits units, dimensional consistency, plausibility, and measurement-uncertainty propagation in scientific calculations.",
      "path": "skills/uncertainty-and-units",
      "content_digest": "155fa7899bb8eb064a5195fdb799f57542cdcd0e6cc04e3ecbe4e695cfd146da",
      "file_count": 14,
      "uncompressed_bytes": 207652
    }
  ],
  "connectors": [
    {
      "id": "structures",
      "required": false,
      "default_selected": true
    },
    {
      "id": "protein-annotation",
      "required": false,
      "default_selected": true
    },
    {
      "id": "literature",
      "required": false,
      "default_selected": true
    },
    {
      "id": "pubmed",
      "required": false,
      "default_selected": true
    }
  ]
}
