{
  "schema_version": 1,
  "specialist_id": "high-throughput-dft-screener",
  "version": "1.0.0",
  "source": {
    "repository": "https://github.com/K-Dense-AI/scientific-agent-skills",
    "commit": "36d8f13a1e754618794bf42f417884940077b4ae",
    "license": "MIT"
  },
  "artifact": {
    "path": "specialists/high-throughput-dft-screener/1.0.0/high-throughput-dft-screener-1.0.0.zip",
    "github_release": {
      "tag": "high-throughput-dft-screener-v1.0.0",
      "asset_name": "high-throughput-dft-screener-1.0.0.zip"
    },
    "sha256": "1df582c42c418ae382720c7ced228135c495230a982100d8a87ddf2cc85270af",
    "compressed_bytes": 167653,
    "uncompressed_bytes": 447529,
    "file_count": 39
  },
  "defaults": {
    "skill_ids": [
      "experimental-design",
      "pymatgen",
      "uncertainty-and-units"
    ],
    "connector_ids": [
      "structures",
      "research-resources",
      "literature"
    ]
  },
  "skills": [
    {
      "id": "experimental-design",
      "name": "experimental-design",
      "display_name": "Experimental Design",
      "description": "Designs randomized, blocked, factorial, response-surface, and sequential experiments while preventing confounding and pseudoreplication.",
      "path": "skills/experimental-design",
      "content_digest": "0b0c009f12b72f8d3b5712c08ad21bfafded2310963a4c85aaa4add83d241933",
      "file_count": 7,
      "uncompressed_bytes": 53960
    },
    {
      "id": "pymatgen",
      "name": "pymatgen",
      "display_name": "pymatgen",
      "description": "Validates, converts, and analyzes materials structures, symmetry, phase diagrams, and bounded Materials Project queries.",
      "path": "skills/pymatgen",
      "content_digest": "4055254e0c9ad18c379c685e0d4102240d88075218a4b8a5b39ae8e81d091c72",
      "file_count": 15,
      "uncompressed_bytes": 162755
    },
    {
      "id": "uncertainty-and-units",
      "name": "uncertainty-and-units",
      "display_name": "Uncertainty and Units",
      "description": "Audits units, dimensional consistency, plausibility, and measurement-uncertainty propagation in scientific calculations.",
      "path": "skills/uncertainty-and-units",
      "content_digest": "155fa7899bb8eb064a5195fdb799f57542cdcd0e6cc04e3ecbe4e695cfd146da",
      "file_count": 14,
      "uncompressed_bytes": 207652
    }
  ],
  "connectors": [
    {
      "id": "structures",
      "required": false,
      "default_selected": true
    },
    {
      "id": "research-resources",
      "required": false,
      "default_selected": true
    },
    {
      "id": "literature",
      "required": false,
      "default_selected": true
    }
  ]
}
